{
  "schema_version": "1.0",
  "algorithm_version": "deterministic-token-overlap-v2",
  "request": "Recover the generated-helper failure caused by requiring an outer wrapper error line that is absent from the internally preserved terminal artifact. Run failure-triggered SAGE retrieval before retry, verify the original active-lifecycle render rejection only from stable repository-owned markers, require the render validator to fail closed, run the canonical active runtime validator, stage the approved Fluent Bit and Loki availability SLO rules, validate, commit, and push without applying the updated rule to the cluster.",
  "policy_sha256": "1572ddc9347c97d2c36014e363f5bc8547f81879458b39ed95f990cd8031465d",
  "sources": [
    {
      "path": "markdown/evidence/catalog.json",
      "source_type": "evidence",
      "records_loaded": 36
    },
    {
      "path": "sage-lessons.json",
      "source_type": "lesson",
      "records_loaded": 11
    },
    {
      "path": "sage-actionable-failures.json",
      "source_type": "failure",
      "records_loaded": 3
    },
    {
      "path": "sage-improvement-actions.json",
      "source_type": "improvement_action",
      "records_loaded": 7
    },
    {
      "path": "sage-post-session-review-registry.json",
      "source_type": "post_session_review",
      "records_loaded": 1
    }
  ],
  "results": [
    {
      "rank": 1,
      "source_type": "evidence",
      "identifier": "SAGE-K3-GUARDRAIL-20260731-001",
      "title": "Actionable Guardrail Recovery and Active Centralized Logging Runtime Validation Evidence",
      "source_path": "markdown/evidence/catalog.json",
      "record_path": "",
      "status": "validated",
      "score": 78,
      "matched_terms": [
        "active",
        "centralized",
        "evidence",
        "failures",
        "guardrail",
        "logging",
        "loki",
        "recover",
        "runtime",
        "sage",
        "validate",
        "validated",
        "validation"
      ],
      "matched_groups": [
        "evidence",
        "logging",
        "validation"
      ],
      "reasons": [
        "title matched active, centralized, evidence, guardrail, logging, runtime, validation (+49)",
        "tags matched loki, sage (+10)",
        "status matched validated (+1)",
        "body matched failures, recover, validate (+3)",
        "source type evidence (+4)",
        "request groups evidence, logging, validation (+9)",
        "validated status validated (+2)"
      ],
      "confidence": {
        "value": "high",
        "source_field": "confidence",
        "basis": "explicit-source-field"
      },
      "applicable_facts": [
        {
          "source_field": "title",
          "value": "Actionable Guardrail Recovery and Active Centralized Logging Runtime Validation Evidence",
          "matched_terms": [
            "active",
            "centralized",
            "evidence",
            "guardrail",
            "logging",
            "runtime",
            "validation"
          ]
        },
        {
          "source_field": "nav_title",
          "value": "Recover guardrails and validate active logging",
          "matched_terms": [
            "active",
            "logging",
            "recover",
            "validate"
          ]
        },
        {
          "source_field": "summary",
          "value": "Documents the reusable SAGE actionable-failure framework, centralized-logging lifecycle recovery, vault-tolerant metadata handling, and live seven-node Loki validation.",
          "matched_terms": [
            "loki",
            "sage",
            "validation"
          ]
        },
        {
          "source_field": "primary_subject",
          "value": "SAGE actionable failures",
          "matched_terms": [
            "failures",
            "sage"
          ]
        },
        {
          "source_field": "status",
          "value": "validated",
          "matched_terms": [
            "validated"
          ]
        }
      ],
      "source_section": {
        "record_field": "title",
        "navigation_section": "governance",
        "source_document": "markdown/governance/kalaxy3-actionable-guardrail-recovery-evidence.md"
      },
      "recency": {
        "value": "2026-07-31",
        "source_field": "valid_as_of",
        "basis": "explicit-source-field"
      },
      "disposition": "pending",
      "disposition_rationale": ""
    },
    {
      "rank": 2,
      "source_type": "evidence",
      "identifier": "SAGE-K3-OBS-20260728-002",
      "title": "Centralized Logging Activation, Deployment, Correction, and Runtime Validation Evidence",
      "source_path": "markdown/evidence/catalog.json",
      "record_path": "",
      "status": "validated",
      "score": 77,
      "matched_terms": [
        "bit",
        "centralized",
        "evidence",
        "fluent",
        "health",
        "logging",
        "logs",
        "loki",
        "runtime",
        "sage",
        "validated",
        "validation"
      ],
      "matched_groups": [
        "evidence",
        "logging",
        "validation"
      ],
      "reasons": [
        "title matched centralized, evidence, logging, runtime, validation (+35)",
        "tags matched loki, sage (+10)",
        "summary matched bit, fluent, health, logs (+16)",
        "status matched validated (+1)",
        "source type evidence (+4)",
        "request groups evidence, logging, validation (+9)",
        "validated status validated (+2)"
      ],
      "confidence": {
        "value": "high",
        "source_field": "confidence",
        "basis": "explicit-source-field"
      },
      "applicable_facts": [
        {
          "source_field": "summary",
          "value": "Documents activating and deploying Loki and Fluent Bit, correcting Grafana datasource reconciliation, and validating storage, all-node collection, Grafana health, and queryable logs.",
          "matched_terms": [
            "bit",
            "fluent",
            "health",
            "logs",
            "loki"
          ]
        },
        {
          "source_field": "title",
          "value": "Centralized Logging Activation, Deployment, Correction, and Runtime Validation Evidence",
          "matched_terms": [
            "centralized",
            "evidence",
            "logging",
            "runtime",
            "validation"
          ]
        },
        {
          "source_field": "primary_subject",
          "value": "Centralized observability logging",
          "matched_terms": [
            "centralized",
            "logging"
          ]
        },
        {
          "source_field": "nav_title",
          "value": "Deploy centralized logging observability",
          "matched_terms": [
            "centralized",
            "logging"
          ]
        },
        {
          "source_field": "status",
          "value": "validated",
          "matched_terms": [
            "validated"
          ]
        }
      ],
      "source_section": {
        "record_field": "summary",
        "navigation_section": "operations",
        "source_document": "markdown/operations/kalaxy3-centralized-logging-deployment-evidence.md"
      },
      "recency": {
        "value": "2026-07-28",
        "source_field": "valid_as_of",
        "basis": "explicit-source-field"
      },
      "disposition": "pending",
      "disposition_rationale": ""
    },
    {
      "rank": 3,
      "source_type": "evidence",
      "identifier": "SAGE-K3-OBS-20260728-001",
      "title": "Iterative SAGE-Governed Observability Staging and Activation-Readiness Evidence",
      "source_path": "markdown/evidence/catalog.json",
      "record_path": "",
      "status": "validated",
      "score": 66,
      "matched_terms": [
        "bit",
        "centralized",
        "commit",
        "evidence",
        "fluent",
        "logging",
        "loki",
        "push",
        "sage",
        "stage",
        "validated",
        "validation",
        "without"
      ],
      "matched_groups": [
        "evidence",
        "logging",
        "validation"
      ],
      "reasons": [
        "title matched evidence (+7)",
        "tags matched loki, sage (+10)",
        "summary matched bit, centralized, commit, fluent, logging, push, validation, without (+32)",
        "status matched validated (+1)",
        "body matched stage (+1)",
        "source type evidence (+4)",
        "request groups evidence, logging, validation (+9)",
        "validated status validated (+2)"
      ],
      "confidence": {
        "value": "high",
        "source_field": "confidence",
        "basis": "explicit-source-field"
      },
      "applicable_facts": [
        {
          "source_field": "summary",
          "value": "Documents the iterative ChatGPT-SAGE discovery, correction, validation, commit, and push cycle that made Kalaxy3 centralized logging activation-ready without deploying Loki or Fluent Bit.",
          "matched_terms": [
            "bit",
            "centralized",
            "commit",
            "fluent",
            "logging",
            "loki",
            "push",
            "validation",
            "without"
          ]
        },
        {
          "source_field": "nav_title",
          "value": "Stage centralized logging through SAGE guardrails",
          "matched_terms": [
            "centralized",
            "logging",
            "sage",
            "stage"
          ]
        },
        {
          "source_field": "primary_subject",
          "value": "Centralized observability logging",
          "matched_terms": [
            "centralized",
            "logging"
          ]
        },
        {
          "source_field": "status",
          "value": "validated",
          "matched_terms": [
            "validated"
          ]
        },
        {
          "source_field": "tags[0]",
          "value": "sage",
          "matched_terms": [
            "sage"
          ]
        }